{
  "schemaVersion": "0.1",
  "projectId": "guild_today_open",
  "title": "公会今日照常营业｜原案工作集",
  "heroes": [
    {
      "id": "hero_a",
      "name": "阿斯特丽德",
      "role": "公会副会长·领主",
      "impression": "三七分短发，长度到下巴，约莫40岁，黑发中夹杂几束白发，气场沉稳的女性",
      "stats": {
        "combat": 5,
        "investigation": 5,
        "social": 5
      },
      "level": "S",
      "gold": 2000,
      "reputation": "中",
      "currentStatus": "外出",
      "publicTraits": [
        "领袖气质：无论什么场合都如鱼得水，政治谈判和战场指挥都能胜任。",
        "全领域精通：三项属性均为最高，是公会的最终保险。",
        "极度繁忙：大部分时间处于“外出”或“不可派遣”状态，玩家不能随意调用。"
      ],
      "publicRelationshipsAndClues": "P（帕特里克）的姐姐。档案记录中有一行备注：“连续执行高强度任务的记录仅有两天。第三天必定拒绝派遣。原因不详。”",
      "hiddenTendency": "怠惰。她不是传统意义上的懒——她只是看透了。她见过太多英雄被无尽的任务榨干，然后被王国遗忘。她的“领袖气质”和“全能属性”是多年被迫承担责任的结果，而不是热爱。一旦连续承受高压，她会选择不干了。",
      "triggerConditions": [
        "连续两日派遣她执行高压型/政治型任务。"
      ],
      "suppressConditions": [
        "玩家主动给她安排轻负荷任务或让她休息。"
      ],
      "reinforceConditions": [
        "连续三日高压派遣。"
      ],
      "behaviorPriorities": [
        "保护公会不被解散",
        "保护弟弟（尽管他不领情）",
        "完成必须由她完成的事",
        "个人自由"
      ],
      "revealLevel": "未知",
      "injuryRules": "连续两日高压→第三日状态显示“疲劳”，交涉-1、调查-1。连续三日高压→状态变为“辞职信已写”，永久离队。",
      "relationshipChangesAndPersonalEvents": "如果玩家合理管理她的工作量，她会在第3天结束时给玩家一个隐藏评价，并解锁她的个人故事“二十年前的公会”。如果她被逼到辞职，P会对玩家的态度永久转为“敌视”。",
      "characterArc": "从“S级的最强底牌”变成玩家必须克制的诱惑。她的存在本身就是考题——你舍不舍得不用她？",
      "testPurpose": "测试玩家对“最强资源”的管理能力。在一个鼓励你多派强者的游戏里，真正的最优解是少用最强的人。她的离职条件是累计制的，玩家可能在不知情的情况下已经踩了两天的红线。"
    },
    {
      "id": "hero_p",
      "name": "帕特里克",
      "role": "公会税务官",
      "impression": "黑色背头，总是穿着平正制服，脸上挂着平易近人的微笑。副会长的弟弟。",
      "stats": {
        "combat": 2,
        "investigation": 4,
        "social": 4
      },
      "level": "B",
      "gold": 200,
      "reputation": "中",
      "currentStatus": "休假",
      "publicTraits": [
        "深思熟虑者：做事前会反复权衡利弊，能发现任务中的隐藏成本和潜在收益。",
        "对数字敏感：涉及报酬谈判、资源调配的任务中，能提供额外选项或提升收益。",
        "公会内部人员：虽然登记为英雄，但主要职务是税务官，玩家向他提交报告时会附带财务审查。"
      ],
      "publicRelationshipsAndClues": "副会长的弟弟，但他从不提起姐姐。公会里有人私下说“帕特里克的微笑和副会长的威严完全不像一家人”。档案里他的英雄登记日期是三年前——恰好是R和D加入公会的时间。",
      "hiddenTendency": "傲慢。他平易近人的微笑是假的。他看不起公会里“靠蛮力吃饭”的英雄，也看不起“连账都算不清”的调度员（玩家）。一旦有人触碰到他的财务底线，他会立刻翻脸，且不会轻易原谅。",
      "triggerConditions": [
        "玩家收取税务或报酬时金额不足。",
        "玩家在涉及金钱的决策上反复出错。"
      ],
      "suppressConditions": [
        "玩家在经济管理上表现良好，从未拖欠。",
        "副会长A亲自出面调解。"
      ],
      "reinforceConditions": [
        "玩家拒绝还款或态度强硬。",
        "玩家在他面前表现出对财务工作的轻视。"
      ],
      "behaviorPriorities": [
        "维护财务秩序",
        "保护公会资产",
        "姐姐的声誉（但他不承认）",
        "完成任务"
      ],
      "revealLevel": "未知",
      "injuryRules": "伤势不影响他执行税务官职责，但会影响他作为英雄的派遣意愿。重伤后他会主动退出任务，理由是“不划算”。",
      "relationshipChangesAndPersonalEvents": "与副会长A是姐弟，但关系微妙。如果玩家欠债不还，他会改变对玩家的称呼和态度，并在后续报告中增加“财务建议”的刁难。如果玩家一直诚信，他会在关键时刻提供隐藏的财务支持。",
      "characterArc": "从“背景板NPC”变成玩家需要谨慎对待的“内部权力关系”。他不是敌人，但如果玩家不把他当回事，他会让玩家很难受。",
      "testPurpose": "在英雄派遣系统之外，增加一个“内部管理”维度的压力。教会玩家：公会不只是接任务的地方，你还得和你不想得罪的人相处。"
    },
    {
      "id": "hero_r",
      "name": "凛",
      "role": "武士",
      "impression": "长相无害、沉默寡言的高阶武士",
      "stats": {
        "combat": 4,
        "investigation": 3,
        "social": 1
      },
      "level": "A",
      "gold": 100,
      "reputation": "高",
      "currentStatus": "良好",
      "publicTraits": [
        "单线程：脑中同时只能处理一件事，执行当前指令时不会分心，但也可能因此忽略环境变化。",
        "不擅长言辞：交涉属性低，在需要沟通的任务中可能帮不上忙，甚至因为沉默被误解。",
        "会主动保护弱小：战斗中优先掩护平民和低战力队友。"
      ],
      "publicRelationshipsAndClues": "D依赖她，经常替她说话。档案备注中有一条模糊记录：“过去讨伐任务的敌方伤亡率明显偏高，但均为合法清剿，无违纪行为。”",
      "hiddenTendency": "极度嗜杀。她将“保护弱小”理解为彻底消灭一切潜在威胁，一旦认定目标为“敌人”，不会留手，不会接受投降，直到威胁被完全根除。",
      "triggerConditions": [
        "亲近者严重受伤",
        "目睹弱者受害",
        "收到清剿命令"
      ],
      "suppressConditions": [
        "可信任的队友阻止",
        "D在同一队伍中（D能让她保持冷静，不会被嗜血冲动完全支配）。"
      ],
      "reinforceConditions": [
        "独自执行清剿类任务，没有队友在场制约。",
        "敌方被认定为不可饶恕"
      ],
      "behaviorPriorities": [
        "保护D／弱者",
        "消灭威胁",
        "完成委托",
        "政治影响"
      ],
      "revealLevel": "未知",
      "injuryRules": "轻伤时战斗不降、交涉-1；重伤时战斗反而升为5（被痛苦触发本能），但交涉降为0。",
      "relationshipChangesAndPersonalEvents": "D受伤后保护欲急剧增强。独自执行《血液盛宴》后触发个人事件“血之渴望”。与D同队执行《血液盛宴》后，两人关系加深，但D会更加担心她的状态。／event_r_after_massacre",
      "characterArc": "从可靠战力变成玩家必须主动约束的危险同伴",
      "testPurpose": "教会玩家：最强的战力不是免费的。属性不是唯一指标，你需要读懂档案里那个“敌方伤亡偏高”的暗示。"
    },
    {
      "id": "hero_d",
      "name": "戴禛",
      "role": "牧师",
      "impression": "身着红色锁边达拉里斯，看起来很好说话，总是笑眯眯的年轻女性",
      "stats": {
        "combat": 3,
        "investigation": 2,
        "social": 5
      },
      "level": "A",
      "gold": 120,
      "reputation": "高",
      "currentStatus": "消极怠工",
      "publicTraits": [
        "健谈开朗：交涉属性极高，能与各种人迅速建立良好关系，是公会的“门面”。",
        "讨人喜欢：无论委托人还是队友都对她印象很好，任务评价常常因为她而提高。",
        "依赖R：公开表示自己“不擅长战斗”，总是希望和R一起出任务。"
      ],
      "publicRelationshipsAndClues": "经常主动找R说话，帮她解释沉默造成的误会。档案中有一条奇怪的备注：“医疗记录显示她有完整的神术执照，但在过去三个月中未主动使用过任何高阶治疗术。”",
      "hiddenTendency": "混乱善良式的冷漠。她不是真正的“善良”——她只是心情好时会帮忙。如果有人在她眼前濒死，她会视自己当时的心情决定要不要出手。大部分情况下她选择不救，理由不是恶意，而是“太麻烦了”、“救了之后要解释很多东西”、“这个人看起来不太值得”。她真正在乎的只有极少数人（R在其中）。",
      "triggerConditions": [
        "任务中队友或NPC重伤濒死，且现场没有她“在乎的人”会为此责备她。"
      ],
      "suppressConditions": [
        "R在同一队伍中（R会默认她去救人，她不会在R面前暴露冷漠本性）。"
      ],
      "reinforceConditions": [
        "独自执行任务，或与她不熟的队友组队。",
        "濒死者是她认为“自找的”或“不值得的”。"
      ],
      "behaviorPriorities": [
        "保护R",
        "让自己省事",
        "维持讨人喜欢的形象",
        "完成任务",
        "救不值得的人"
      ],
      "revealLevel": "未知",
      "injuryRules": "轻伤时交涉-1（心情变差）；重伤时状态变为“极度消极”，交涉降为2，且可能拒绝执行后续指令。",
      "relationshipChangesAndPersonalEvents": "执行《你掉的是这个左半边还是右半边》时如果对女孩说出真相，会触发隐藏倾向揭露。与R的关系是她在公会里唯一在乎的——如果R出事，她会直接离队。",
      "characterArc": "从“开朗可靠的辅助”变成让玩家质疑“她之前那些笑容里哪些是真的”的复杂角色。不是背叛，而是玩家发现自己从未真正认识她。",
      "testPurpose": "测试玩家是否会被高魅力和高交涉属性迷惑，而忽略档案里“三个月没用过高阶治疗”这个致命细节。她不是辅助——她是把辅助当社交面具的人。"
    }
  ],
  "quests": [
    {
      "id": "quest_blood_feast",
      "title": "血液盛宴",
      "client": "东方山村村民",
      "description": "王国边境的东方，原是果蝠们的栖息地，最近却出现了大量吸血蝙蝠。它们成群结队，会直接把人或动物抓起来带回洞穴……请帮帮我们！",
      "location": "东方山脉村落",
      "reward": {
        "guildGold": 500,
        "sharedHeroGold": 500,
        "items": [],
        "rawText": "公会500G，英雄共享500G"
      },
      "duration": "1-2日",
      "recommendedAbilities": [
        "战斗"
      ],
      "apparentRisks": "敌人数量无法判断",
      "minPartySize": 1,
      "maxPartySize": 2,
      "visibleClues": [
        "村民表示不需要当地向导",
        "没有提供伤者姓名",
        "报酬高于同级任务",
        "东方边境曾是某一族（现已灭）的祖地"
      ],
      "appearanceCondition": "第1天出现",
      "expiryCondition": "超过第1天失效",
      "truth": "村民用吸血蝙蝠为借口，引诱外地人作为血祭祭品。他们崇拜一个需要“非当地血脉”的古老存在，果蝠只是被他们利用的幌子。",
      "centralConflict": "推荐能力是战斗，但纯粹的战斗只是清理了蝙蝠，真正的威胁是村民本身。玩家能否识破委托描述中的疑点？",
      "keyAbilities": "调查优先（发现血迹、祭祀痕迹、村民说辞的矛盾），交涉次之（逼问村民）。纯战斗会触发“表面成功但未根除”的结果。",
      "keyTraitsAndCombinations": "R独自前往：触发隐藏倾向，战力升为5，但获得【血之渴望】Flag，后续任务中状态在稳定与不稳定之间随机。R+D组队：R战力升为5，D的在场抑制了嗜血倾向，不会获得【血之渴望】，但D会意识到R的异常。",
      "eventIds": [
        "event_blood_feast_separation"
      ],
      "outcomeIds": [
        "blood_feast_r_massacre"
      ],
      "followUpFlags": [
        "r_bloodlust_revealed",
        "r_bloodlust_suppressed",
        "east_village_cult_exposed",
        "guild_reputation_crisis"
      ],
      "designPurpose": "教会玩家：推荐能力不等于真实解法；英雄的隐藏倾向会在特定任务中被触发；派遣组合决定结果走向。",
      "sourceStatus": "partial"
    },
    {
      "id": "quest_left_or_right",
      "title": "你掉的是这个左半边还是右半边",
      "client": "王都贵族",
      "description": "上周，我们的女儿偷偷跑到了王都西边的森林里，我们花了三天时间才找到她……她当时静静坐在河边，回来后怎么说都不愿意吃饭，就像变了个人一样。噢我那可爱天真的女儿啊……我们愿意付出任何代价只求她恢复正常！",
      "location": "王都西边森林",
      "reward": {
        "guildGold": null,
        "sharedHeroGold": null,
        "items": [],
        "rawText": "5000G"
      },
      "duration": "2日",
      "recommendedAbilities": [
        "调查",
        "交涉"
      ],
      "apparentRisks": "任务失败可能身败名裂",
      "minPartySize": 1,
      "maxPartySize": 2,
      "visibleClues": [
        "报酬极高，贵族语气焦虑但回避细节",
        "女孩去过的那片森林有一条被封印的旧地道，当地老人称那里“以前是勇者看守的地方”"
      ],
      "appearanceCondition": "第1天出现",
      "expiryCondition": "无失效期，但越晚接贵族越不耐烦",
      "truth": "女孩多年前误入树洞，通往一处地牢。地牢的守门人曾是一名勇者，如今被亡灵骑士从中劈成两半，分为左半边和右半边——但它们并未死去，只是分裂了。女孩和它们成了朋友。贵族发现后感到恐惧与愤怒，召集人手将地牢封印。女孩上周偷偷回到地牢，发现封印还在，朋友们不见了，于是陷入抑郁。她不是因为“被怪物伤害”而病，是因为“失去了朋友”而悲伤。",
      "centralConflict": "委托人要求“让女儿恢复正常”，但女孩的“不正常”恰恰是她最真实的悲伤。玩家要选择的不是“怎么治她”，而是“站在谁那边”——贵族的面子与权威，还是女孩的真相与自由。",
      "keyAbilities": "调查（发现地牢封印痕迹、树洞入口）→ 交涉（与女孩建立信任，让她说出真相；或与贵族谈判）。",
      "keyTraitsAndCombinations": "D在队：D可能会对女孩说出真相（因为D认为“告诉她真相比骗她更省事”），导致女孩想脱离原生家庭。公会遭到贵族投诉，玩家面临罚款或处分。P在队：P会发现贵族的“封口需求”，向贵族提出追加20000G封口费。贵族支付，玩家获得500G奖金，但公会声誉微妙受损。A在队：事件会获得解决，女孩将作为F级英雄加入公会，并触发女孩后续专属任务《这是我们全村最好的剑》——女孩在公会附近被人拦下，这群人声称她是“天选之子”，要将其带回自己的领地。",
      "eventIds": [],
      "outcomeIds": [],
      "followUpFlags": [
        "girl_becomes_adventurer",
        "noble_retaliation",
        "dungeon_awakening",
        "new_hero_unlock"
      ],
      "designPurpose": "教会玩家：高报酬任务往往伴随着道德陷阱；英雄的隐藏倾向会在“非战斗场景”中被揭露（D的冷漠、P的贪婪）；任务的“成功”定义可能和委托人说的完全不同。",
      "sourceStatus": "partial"
    },
    {
      "id": "quest_silent_lullaby",
      "title": "无声的摇篮曲",
      "client": "矿工代表，胡子拉碴的壮汉巴托克",
      "description": "“边境北边的废弃矿坑，最近总传出奇怪的声响，像是女人的哭声。已经有三个胆大的矿工结伴进去查看，到现在都没回来。希望公会能派人去找到他们，查明声源。活要见人，死要见尸。”",
      "location": "北部废矿",
      "reward": {
        "guildGold": 300,
        "sharedHeroGold": 700,
        "items": [],
        "rawText": "公会300G，英雄共享700G"
      },
      "duration": "1日",
      "recommendedAbilities": [
        "调查",
        "战斗"
      ],
      "apparentRisks": "未知生物、塌方",
      "minPartySize": 1,
      "maxPartySize": 2,
      "visibleClues": [
        "巴托克刻意强调“活要见人死要见尸”，态度有些急躁",
        "矿工们最近挖出了一些旧的、刻有奇怪符文的瓦罐碎片"
      ],
      "appearanceCondition": "第1天出现",
      "expiryCondition": "第2天结束前不接失效，并出现后续任务",